timestamp,feedback_text,observation,feeling,need,request,trust_score
2026-01-19T09:15:47.864666,"This course set a very high standard. The grading is tough, but it ensures a strong grasp of fundamentals. Highly recommended.","The course has a high standard and tough grading, but it ensures a strong grasp of fundamentals.",,,,1.0
2026-01-19T09:17:19.997859,I feel frustrated because the grading criteria are unclear and seem arbitrary. I need more transparency in how grades are determined so I can understand my performance better. Could you share a detailed rubric or examples of graded work to help me see the expectations? ,"The student states that grading criteria are unclear and appear arbitrary, and requests more transparency.",frustrated,clarity and transparency in grading to understand performance better,Share a detailed rubric or examples of graded work that illustrate the expectations.,0.97
2026-01-19T11:16:58.930176,I have been struggling with this course and feel that the grading system is unclear to me. I would appreciate a detailed explanation of how grades are determined and specific feedback on my assignments so that I can understand what is expected and improve my performance. Thank you for your support ,The student has been struggling with the course and finds the grading system unclear.,frustrated/uncertain,clarity and constructive guidance on grading and assignments,a detailed explanation of how grades are determined and specific feedback on assignments to improve performance,0.9
2026-01-19T11:20:51.015936,"Overall an okay course, but grading could be improved to better reflect student understanding ","The course was described as generally acceptable, but the grading system is seen as not fully reflecting student understanding.",Slight dissatisfaction or concern about grading fairness,Accurate and fair assessment that aligns with students' demonstrated knowledge,Revise grading criteria or provide clearer feedback to better match student understanding,0.92
2026-01-19T11:55:09.823806,"I noticed that the grading in this course seems to be influenced by the specific TAs assigned, which makes me feel concerned about fairness. I need a grading process that accurately reflects student understanding. Could we consider having each assignment graded by several TAs, rotating them so that no single TA consistently grades the same students, and then averaging those scores? This would help ensure fairness for all students ",The student observed that grading appears to be influenced by specific TAs and suggested rotating multiple TAs per assignment.,concerned,fairness in grading that accurately reflects student understanding,Rotate multiple TAs to grade each assignment and average their scores to ensure fairness for all students,0.85
